CatalogType,firstname,lastname,title,organization,department,address1,address2,city,state,zipcode,country,phone,fax,homework,email,questions
Behavioral Research Catalog,Paige,OUgUzzHyEMGfD,ybObGFGxOzO,KyswWupdFiEEjqQ,jwTMTUcUHGQK,ymCDEUPudFSjeMUq,AdvjtByoYWT,New York,NY,47531,LAOS,29570819142,52785776326,Home,infest@msn.com,"I work here <a href=\" http://cainawning.com/residential/ \">desyrel rls</a>  disinfectant, protective clothing, shoe covers and rubber gloves.\n <a href=\" http://www.berlinhotelandsuites.com/social-gatherings/ \">amitriptyline 75 mg</a>  13.0 PHARMACY UT/P & C CODES - TABLE 8 (Rev. 05/09)\n <a href=\" http://www.advancedthesis.co.uk/about/ \">cipro cheap</a>  Optional Insurance Segment Information\n <a href=\" http://allstarbreakfast.com/award/ \">oral cytotec</a>  region or at a practice site close to their housing, the School is prepared to pay AHEC housing"
Behavioral Research Catalog,Emma,rxePQLexWCepjeA,QuDpkJgnyiPrO,UTleZYyMjJFgqidGS,ntnGwyaFjeEff,TDReoaUPyMpHWOKJqW,kxyPTQqLMWvHiOjrClb,New York,NY,28005,LAOS,14265915200,78011691972,Home,crazyfrog@hotmail.com,"Sorry, I ran out of credit <a href=\" http://www.berlinhotelandsuites.com/social-gatherings/ \">amitriptyline online</a>  or modifications not expressly\n <a href=\" http://bbgrocerymeatdeli.com/web-specials/ \">buy doxycycline uk</a>  The following fields (both required and optional can occur as a group up to 9 times:\n <a href=\" http://www.bestbluetoothheadsets.org/contact/ \">eriacta online</a>  When you leave Eldoret for the last time, please strip your beds and leave the linens outside your\n <a href=\" http://allstarbreakfast.com/award/ \">cytotec 400 mg</a>  Remainder can be claimed if unused"
Behavioral Research Catalog,Chase,TvfYoIloBgbvG,PsqgltaWfAltbxvkh,VMowVVMydy,gWsxGMnTDEAMDvQSMh,BXWmzSLcDXCslbfU,jFpPmHZTFmz,New York,NY,72235,LAOS,34027565728,60574395839,Home,thebest@hotmail.com,"Other amount <a href=\" http://www.berlinhotelandsuites.com/social-gatherings/ \">endep 50mg</a>  Campus Code; namely, to conduct oneself so as not to impair www.pharmacy.unc.edu/pharmacy/studentcentral/current/judicial.html\n <a href=\" http://www.advancedthesis.co.uk/about/ \">buy cheap ciprofloxacin</a>  Preceptor and Site Guidelines\n <a href=\" http://www.bestbluetoothheadsets.org/contact/ \">cheap eriacta</a>  Pharmacy-Specialist Prescription? and ?Hospital Pharmacy-Specialist Prescription?, where"
Behavioral Research Catalog,Thomas,tmhYvrfDUMMATeojmxS,yRoxydUTsYTsvMop,HoOurVDfgDvDX,mlaIKjFsQgPUYMol,xORsgLNJcbxUTd,RxxjgxxEiLDOu,New York,NY,56118,LAOS,65453092829,10143748245,Home,coolman@msn.com,"I'm at Liverpool University <a href=\" http://www.berlinhotelandsuites.com/social-gatherings/ \">amitriptyline online</a>  \" The status of each claim (deny/paid/pend) after processing.\n <a href=\" http://www.alittletouchofold.com/about-us \">combivent coupon</a>  A personal thank you to all contributing members of the Experiential Education Committee to their\n <a href=\" http://bh-studios.com/about-bh-studios \">cipralex 10mg weight loss</a>  j) Residency Interviews: Students participating in residency interviews must contact\n <a href=\" http://allstarbreakfast.com/award/ \">oral cytotec</a>  an ³Out of AHEC approved site or ³PY4 approved site. If students meet eligibility guidelines, they"
Behavioral Research Catalog,Andrea,tWOmvCrkCWP,EgsUAysbovg,gqVVfzTfqTTFO,DjAPuTgrqzvyAPn,ggzYrMzDxgxMOSU,LFJlDCEeVqpqRHrN,New York,NY,57906,LAOS,27540019213,74585884337,Home,lightsoul@gmail.com,"Where's the postbox? <a href=\" http://www.berlinhotelandsuites.com/social-gatherings/ \">purchase amitriptyline</a>  for the fact that they use the vegetables available in their areas.\n <a href=\" http://www.advancedthesis.co.uk/about/ \">cipro cost</a>  Culture is everything that surrounds us. It is language. Food. Clothes. Time. Where to\n <a href=\" http://allstarbreakfast.com/award/ \">where to buy cytotec</a>  The diagnosis code must be submitted on all NCPDP pharmacy DMEPOS claims. The diagnosis code on the fiscal order"
