firstname,lastname,title,organization,department,address1,address2,city,state,zipcode,country,phone,fax,homework,email,questions
ATHANASIOS,KOTROTSOS,,APPLIED MECHANICS LABORATORY AND VIBRATIONS,,PATRAS UNIVERSITY CAMPUS,,PATRAS,ACHAIA,26500,GREECE,,,,akotrotso@mech.upatras.gr,"Hello, \r\nplease sent me a quotation or a catalog with the prices about the fine gauge (20) blunt tip needles and also for coaxial.Please sent me quickly because it is urgent.\r\nAthanasios Kotrotsos,\r\nDipl.-ing., Msc., Phd Candidate\r\nComposites Research Engineer\r\nApplied Mechanics Laboratory\r\nDepartment of Mechanical Engineering & Aeronautics\r\nUniversity of Patras, GR 26504\r\nRio-Patras, Greece\r\ntel: +30 2610 969443\r\nfax: +30 2610 969417\r\ne-mail adress: akotrotso@mech.upatras.gr\r\nweb: http://aml.mech.upatras.gr"
Cees,Schumacher,Mr.,Academic Medical Center,Experimental Cardiology,Meibergdreef 9,,Amsterdam,Non-USA,1105AZ,NETHERLANDS,31205663254,,,cees.schumacher@gmail.com,"I would like to receiveme a quotation for glass capillaries\r\n\r\n300034 (4 units of 500 capillaries)"
Martin,Hubalek,,Institute of organic chemistry and biochemistry,,,,Prague,Non-USA,,CZECH REPUBLIC,+420220183117,,,hubalek@uochb.cas.cz,
Jill,Ward,,Xerox,,,,,Oregon,,U.S.A.,,,,jill.ward2@xerox.com,"To Whom It May Concern,\r\n\r\nPlease remove the following from all your mailing lists as they are either no longer at this location or they no longer wish to receive mailings from you.\r\nHAL FRAME\r\nMANAGER\r\nXEROX CORPORATION\r\nMAIL STOP 61\r\n26600 SW PARKWAY AVE\r\nWILSONVILLE, OR 97070 9246\r\n\r\nThank you,\r\nXerox Mail Services"
Greg,Fraley,Dr.,Hope College,,35 EAst 12 St,SC3065,Holland,MI,49423,U.S.A.,,,,fraley@hope.edu,Please tell me that your software for the elevated plus maze is also Mac compatible?????
Pradeep,Punnakkal,Dr.,Sree chitra trivandrum,,,,Basel,Non-USA,,INDIA,,,,pptirur@yahoo.co.in,please send me the quote
